{
  "id": "019a2b3c-4d5e-7f00-8a00-000000000005",
  "site_id": "019a2b3c-4d5e-7f00-8a00-000000000001",
  "name": "Raktár hátsó ajtó",
  "instruction": "Ellenőrizd, hogy az ajtó zárva van-e.",
  "tag_type": "nfc_dna",
  "tag_uid": "04112233445566",
  "qr_payload": "waypost:cp:019a2b3c-4d5e-7f00-8a00-000000000005:Zz09Yy18Xx27Ww36",
  "lat_e7": 474979000,
  "lng_e7": 190402000,
  "accuracy_dm": null,
  "photo_media_id": "019a2b3c-4d5e-7f00-8a00-000000000011",
  "active": true,
  "created_at": "2026-10-20T08:00:00.000Z",
  "updated_at": "2026-10-27T10:05:12.345Z"
}
